{
  "$schema": "https://json-schema.org/draft/2020-12/schema",
  "$id": "urn:object:ontology:opm-model/0.1.0",
  "title": "OPM model, format 0.1",
  "description": "A project model built from OPM concepts: objects, processes, states and links. Objects and processes are keyed by an identifier in camelCase. Every reference to another thing uses that identifier. The format follows the OPM link types of ISO 19450; a module is an object with role module, described only by the processes it takes part in.",
  "type": "object",
  "additionalProperties": false,
  "properties": {
    "$schema": {
      "type": "string"
    },
    "name": {
      "type": "string",
      "minLength": 1,
      "description": "Model name, used as the document title."
    },
    "description": {
      "type": "string"
    },
    "objects": {
      "type": "object",
      "propertyNames": {
        "$ref": "#/$defs/id"
      },
      "additionalProperties": {
        "$ref": "#/$defs/object"
      }
    },
    "processes": {
      "type": "object",
      "propertyNames": {
        "$ref": "#/$defs/id"
      },
      "additionalProperties": {
        "$ref": "#/$defs/process"
      }
    },
    "views": {
      "description": "Additional diagrams. The system view and a view for every in-zoomed process are generated without being listed here.",
      "type": "object",
      "propertyNames": {
        "$ref": "#/$defs/id"
      },
      "additionalProperties": {
        "$ref": "#/$defs/view"
      }
    },
    "stories": {
      "description": "User stories, each drawn as a makigami: one lane per agent or module, the steps in time order, what each step hands over to another lane, and the problems found on the way. Lanes, processes and handed-over objects are identifiers of this model, so the validator checks a story against it. OPL skips this section.",
      "type": "object",
      "propertyNames": {
        "$ref": "#/$defs/id"
      },
      "additionalProperties": {
        "$ref": "#/$defs/story"
      }
    },
    "layout": {
      "description": "Optional positions per view: view key (system, structure, a process id for its zoom view, or a custom view key) -> thing id -> [x, y] of the top-left corner. A view without an entry is laid out automatically. The validator, the Mermaid renderer and OPL ignore this section.",
      "type": "object",
      "additionalProperties": {
        "type": "object",
        "propertyNames": {
          "$ref": "#/$defs/id"
        },
        "additionalProperties": {
          "type": "array",
          "prefixItems": [
            {
              "type": "integer"
            },
            {
              "type": "integer"
            }
          ],
          "minItems": 2,
          "maxItems": 2
        }
      }
    }
  },
  "$defs": {
    "id": {
      "description": "Identifier in camelCase, for example priceResult. The default label is derived from it: Price Result.",
      "type": "string",
      "pattern": "^[a-z][A-Za-z0-9]*$"
    },
    "ids": {
      "type": "array",
      "minItems": 1,
      "uniqueItems": true,
      "items": {
        "$ref": "#/$defs/id"
      }
    },
    "note": {
      "description": "A note in Markdown, with \\n for line breaks. The diagram editor opens [text](https://...) links and bare https:// addresses in the browser, and a relative path such as [spec](docs/spec.md) opens that file from the model's folder. The validator and the renderers skip notes.",
      "type": "string"
    },
    "objectRef": {
      "description": "An object, by identifier or as {\"object\": \"...\", \"note\": \"...\"} when the link carries a note.",
      "oneOf": [
        {
          "$ref": "#/$defs/id"
        },
        {
          "type": "object",
          "additionalProperties": false,
          "required": [
            "object"
          ],
          "properties": {
            "object": {
              "$ref": "#/$defs/id"
            },
            "note": {
              "$ref": "#/$defs/note"
            }
          }
        }
      ]
    },
    "objectRefs": {
      "type": "array",
      "minItems": 1,
      "items": {
        "$ref": "#/$defs/objectRef"
      }
    },
    "processRef": {
      "description": "A process, by identifier or as {\"process\": \"...\", \"note\": \"...\"} when the link carries a note.",
      "oneOf": [
        {
          "$ref": "#/$defs/id"
        },
        {
          "type": "object",
          "additionalProperties": false,
          "required": [
            "process"
          ],
          "properties": {
            "process": {
              "$ref": "#/$defs/id"
            },
            "note": {
              "$ref": "#/$defs/note"
            }
          }
        }
      ]
    },
    "processRefs": {
      "type": "array",
      "minItems": 1,
      "items": {
        "$ref": "#/$defs/processRef"
      }
    },
    "object": {
      "type": "object",
      "additionalProperties": false,
      "properties": {
        "label": {
          "type": "string",
          "minLength": 1,
          "description": "Display name. Default: derived from the identifier."
        },
        "description": {
          "type": "string"
        },
        "note": {
          "$ref": "#/$defs/note"
        },
        "role": {
          "enum": [
            "module"
          ],
          "description": "module: a part of the system that processes require. Only what it takes part in describes it."
        },
        "essence": {
          "enum": [
            "informatical",
            "physical"
          ],
          "default": "informatical"
        },
        "affiliation": {
          "enum": [
            "systemic",
            "environmental"
          ],
          "default": "systemic",
          "description": "environmental: outside the system being modeled."
        },
        "states": {
          "type": "array",
          "minItems": 2,
          "uniqueItems": true,
          "items": {
            "type": "string",
            "pattern": "^[A-Za-z][A-Za-z0-9_-]*$"
          }
        },
        "schema": {
          "type": "string",
          "pattern": "^[^#]+#/.*$",
          "description": "JSON Schema definition of the object's data: a file path relative to this model and a JSON pointer, for example contracts.schema.json#/$defs/priceResult. The validator checks that the definition exists and that the states occur in its enums."
        },
        "consistsOf": {
          "$ref": "#/$defs/objectRefs",
          "description": "Aggregation: the parts of this object."
        },
        "exhibits": {
          "$ref": "#/$defs/objectRefs",
          "description": "Exhibition: the attributes of this object."
        },
        "isA": {
          "$ref": "#/$defs/objectRef",
          "description": "Generalization: the more general object."
        },
        "tagged": {
          "description": "Tagged structural links: this object relates to another object with a free-text tag, for example \"is sent to\".",
          "type": "array",
          "minItems": 1,
          "items": {
            "type": "object",
            "additionalProperties": false,
            "required": [
              "object",
              "tag"
            ],
            "properties": {
              "object": {
                "$ref": "#/$defs/id"
              },
              "tag": {
                "type": "string",
                "minLength": 1
              },
              "note": {
                "$ref": "#/$defs/note"
              }
            }
          }
        }
      }
    },
    "process": {
      "type": "object",
      "additionalProperties": false,
      "properties": {
        "label": {
          "type": "string",
          "minLength": 1
        },
        "description": {
          "type": "string"
        },
        "note": {
          "$ref": "#/$defs/note"
        },
        "essence": {
          "enum": [
            "informatical",
            "physical"
          ],
          "default": "informatical"
        },
        "affiliation": {
          "enum": [
            "systemic",
            "environmental"
          ],
          "default": "systemic"
        },
        "handledBy": {
          "$ref": "#/$defs/objectRefs",
          "description": "Agent links: the humans who perform the process."
        },
        "requires": {
          "$ref": "#/$defs/refs",
          "description": "Instrument links: objects the process needs but does not change, including modules. An entry may name a state of the object."
        },
        "consumes": {
          "$ref": "#/$defs/refs",
          "description": "Consumption links: objects the process uses up. An entry may name a state of the object."
        },
        "yields": {
          "$ref": "#/$defs/refs",
          "description": "Result links: objects the process creates. An entry may name a state of the object."
        },
        "affects": {
          "$ref": "#/$defs/objectRefs",
          "description": "Effect links: objects the process changes without naming states."
        },
        "changes": {
          "description": "State-specified effect links: the process changes an object from one state to another.",
          "type": "array",
          "minItems": 1,
          "items": {
            "type": "object",
            "additionalProperties": false,
            "required": [
              "object",
              "to"
            ],
            "properties": {
              "object": {
                "$ref": "#/$defs/id"
              },
              "from": {
                "type": "string"
              },
              "to": {
                "type": "string"
              },
              "note": {
                "$ref": "#/$defs/note"
              }
            }
          }
        },
        "conditions": {
          "$ref": "#/$defs/stateRefs",
          "description": "Condition links: the process occurs only if the object exists, or is in the given state; otherwise it is skipped."
        },
        "events": {
          "$ref": "#/$defs/stateRefs",
          "description": "Event links: the object, or the object entering the given state, starts the process."
        },
        "zoomsInto": {
          "type": "array",
          "uniqueItems": true,
          "items": {
            "$ref": "#/$defs/id"
          },
          "description": "In-zooming: the subprocesses, in order of execution. An empty list is a zoom view without subprocesses yet."
        },
        "invokes": {
          "$ref": "#/$defs/processRefs",
          "description": "Invocation links: processes this process starts."
        },
        "consistsOf": {
          "$ref": "#/$defs/processRefs",
          "description": "Aggregation of processes: the parts of this process."
        },
        "isA": {
          "$ref": "#/$defs/processRef",
          "description": "Generalization: the more general process."
        }
      }
    },
    "stateRefs": {
      "type": "array",
      "minItems": 1,
      "items": {
        "type": "object",
        "additionalProperties": false,
        "required": [
          "object"
        ],
        "properties": {
          "object": {
            "$ref": "#/$defs/id"
          },
          "state": {
            "type": "string"
          },
          "note": {
            "$ref": "#/$defs/note"
          }
        }
      }
    },
    "view": {
      "type": "object",
      "additionalProperties": false,
      "properties": {
        "title": {
          "type": "string",
          "minLength": 1
        },
        "description": {
          "type": "string"
        },
        "process": {
          "$ref": "#/$defs/id",
          "description": "Show this process, its links and its subprocesses."
        },
        "things": {
          "$ref": "#/$defs/ids",
          "description": "Show these objects and processes and the links between them."
        }
      },
      "oneOf": [
        {
          "required": [
            "process"
          ]
        },
        {
          "required": [
            "things"
          ]
        }
      ]
    },
    "ref": {
      "description": "An object, or an object in a given state, with an optional note: \"license\" or {\"object\": \"license\", \"state\": \"expired\", \"note\": \"...\"}.",
      "oneOf": [
        {
          "$ref": "#/$defs/id"
        },
        {
          "type": "object",
          "additionalProperties": false,
          "required": [
            "object"
          ],
          "properties": {
            "object": {
              "$ref": "#/$defs/id"
            },
            "state": {
              "type": "string"
            },
            "note": {
              "$ref": "#/$defs/note"
            }
          }
        }
      ]
    },
    "refs": {
      "type": "array",
      "minItems": 1,
      "items": {
        "$ref": "#/$defs/ref"
      }
    },
    "story": {
      "type": "object",
      "additionalProperties": false,
      "required": [
        "story",
        "lanes",
        "steps"
      ],
      "properties": {
        "title": {
          "type": "string",
          "minLength": 1,
          "description": "Title of the story. Default: derived from its key."
        },
        "story": {
          "type": "string",
          "minLength": 1,
          "description": "The story sentence, for example \"As a customer I want ..., so that ...\"."
        },
        "lanes": {
          "description": "The participants, in the order the lanes are drawn from the top: objects of the model that are agents (essence physical) or modules.",
          "type": "array",
          "minItems": 1,
          "items": {
            "$ref": "#/$defs/id"
          }
        },
        "steps": {
          "description": "The steps in time order; each one is drawn in its own column of the makigami.",
          "type": "array",
          "minItems": 1,
          "items": {
            "$ref": "#/$defs/storyStep"
          }
        },
        "doneWhen": {
          "description": "Acceptance criteria: sentences that are true when the story is done.",
          "type": "array",
          "items": {
            "type": "string",
            "minLength": 1
          }
        },
        "note": {
          "$ref": "#/$defs/note"
        }
      }
    },
    "storyStep": {
      "type": "object",
      "additionalProperties": false,
      "required": [
        "lane",
        "does"
      ],
      "properties": {
        "lane": {
          "$ref": "#/$defs/id",
          "description": "The lane that does the step; one of the story's lanes."
        },
        "does": {
          "type": "string",
          "minLength": 1,
          "description": "What the lane does, as a sentence."
        },
        "process": {
          "$ref": "#/$defs/id",
          "description": "The process of the model the step belongs to. The lane should handle it (an agent) or be required by it (a module), directly or through its subprocesses or parents."
        },
        "handsOver": {
          "description": "What the step passes to another lane. The arrow goes to the next step of the target lane.",
          "type": "object",
          "additionalProperties": false,
          "required": [
            "object",
            "to"
          ],
          "properties": {
            "object": {
              "$ref": "#/$defs/id",
              "description": "The object handed over; the step's process should consume, yield, affect, change, require or have it as a condition."
            },
            "state": {
              "type": "string",
              "description": "A state of the object at the hand-over."
            },
            "to": {
              "$ref": "#/$defs/id",
              "description": "The receiving lane; one of the story's lanes."
            },
            "note": {
              "$ref": "#/$defs/note"
            }
          }
        },
        "waits": {
          "type": "string",
          "minLength": 1,
          "description": "How long the step waits or takes, as free text, for example \"up to a few seconds\"."
        },
        "problem": {
          "type": "string",
          "minLength": 1,
          "description": "A problem found at this step, drawn as a red card below it."
        },
        "note": {
          "$ref": "#/$defs/note"
        }
      }
    }
  }
}
